{"token":{"currency":"BBL","issuer":"rLXCWBHdR489cqwtcwai6QHEdFSkhFoFGP","launchId":"ddc2b683-88c6-4407-a07f-d08ec90b2754","network":"testnet"},"launchId":"ddc2b683-88c6-4407-a07f-d08ec90b2754","stage":"spoke","ringsActive":1,"rings":[{"id":"VELOCITY","allocUsd":2500,"dailyEarnUsd":2.1,"marginalBps":3.2,"utilization":0.12}],"mode":"SIMULATION","at":"2026-10-24T10:00:00.000Z"}
